id,status,checkpoint,scope,target_files,acceptance,verification,notes
CM-018.1,verified,Update release dependency records,"Dependency versions URLs hashes","packaging/dependencies.env","Every maintained release dependency in the modern stack has version, archive, URL, and SHA-256 ownership recorded.","`packaging/dependencies.env` records zlib, libssh2 as libcurl-internal SSH support, curl 8.20.0, Boost, libtorrent-rasterbar, OpenSSL, Android NDK, and llvm-mingw; c-ares and direct libssh2 backend ownership are absent.","libssh2 remains only inside the selected libcurl release closure."
CM-018.2,verified,Update release helper scripts,"Dependency build and static closure","packaging/scripts/common.sh; packaging/scripts/mingw-release; packaging/scripts/android-release","Release helpers build and locate the modern dependency set without host leakage.","`build_libssh2_for_curl` and `build_curl` were added to `packaging/scripts/common.sh`; local macOS release-closure smoke built zlib, OpenSSL, libssh2-for-curl, and curl 8.20.0, then verified `pkg-config --libs --static libcurl` had no Homebrew, Cellar, xz, or nghttp2 leakage.","libcurl is built with OpenSSL, zlib, libssh2, and pruned unused protocols/features."
CM-018.3,verified,Update Dockerfiles and workflows,"Cross-platform release paths","packaging/docker; .github/workflows","Linux, macOS, Windows, and Android release paths know the new dependency closure and removed features.","`.github/workflows/ci.yml`, `.github/workflows/release.yml`, `packaging/docker/Dockerfile.mingw`, and `packaging/docker/Dockerfile.android` now build libssh2 only as libcurl input, build libcurl from source, and no longer build c-ares or pass removed CMake switches.","Artifact naming rules are unchanged."
CM-018.4,verified,Run packaging syntax checks,"Shell and YAML validation","packaging scripts; scripts; workflows","Shell syntax checks and YAML parsing pass for changed packaging and release files.","`bash -n` passed for `tools/build_test.sh`, `scripts/bump-version.sh`, `scripts/release.sh`, `packaging/scripts/common.sh`, `packaging/scripts/check-runtime-deps`, `packaging/scripts/mingw-release`, and `packaging/scripts/android-release`; Python YAML parsing passed for CI and release workflows.","Workflow job step names were inspected after mechanical edits."
CM-018.5,verified,Run local dependency closure smoke,"Static and runtime dependency checks","/Users/sekiro/Desktop/aria2-next-current artifacts","A local release-style helper smoke proves key dependency discovery and runtime closure assumptions.","Local smoke under `/Users/sekiro/Desktop/aria2-next-current/cm018-curl-helper-smoke` built the libcurl closure and reported libcurl 8.20.0 with static libs limited to the smoke prefix plus system macOS frameworks.","Temporary smoke artifacts are outside the repository."
