id,status,checkpoint,scope,target_files,acceptance,verification,notes
CM-008.1,verified,Map cookies to libcurl,"Cookie jar and Set-Cookie behavior","src/CurlDownloadCommand.*; option handling; tests","Supported cookie load/save behavior is mapped to libcurl cookie APIs.","CurlDownloadCommand enables the libcurl cookie engine, maps load-cookies to CURLOPT_COOKIEFILE, maps save-cookies to CURLOPT_COOKIEJAR, and focused build plus RequestGroup routing tests passed.","Browser cookie import is removed."
CM-008.2,verified,Decide browser cookie import,"Firefox Chromium SQLite cookie behavior","src/CookieStorage.*; src/Sqlite3CookieParser*; dependency-ledger.csv","Browser cookie import is either removed or justified by current product value with a narrow owner.","Firefox and Chromium SQLite browser-cookie import was pruned. CookieStorage, Cookie, NsCookieParser, Sqlite3CookieParser, SQLite CMake checks, SQLite test inventory, SQLite packaging version source, and SQLite release build steps were removed.","libcurl cookie-file support remains."
CM-008.3,verified,Map netrc and auth,"Netrc and authentication ownership","src/Netrc*; src/AuthConfig*; src/CurlDownloadCommand.*","netrc and auth behavior is mapped to libcurl where retained, and obsolete native parsers are removed.","CurlDownloadCommand maps HTTP credentials to CURLOPT_USERPWD and CURLAUTH_ANY, maps FTP-family URI or option credentials to CURLOPT_USERNAME and CURLOPT_PASSWORD, maps netrc to CURLOPT_NETRC and CURLOPT_NETRC_FILE, and removes native Netrc/AuthConfig/AuthResolver ownership.","The old http-auth-challenge option was removed because libcurl owns challenge handling."
CM-008.4,verified,Remove native proxy helpers,"Proxy request/tunnel source cleanup","src/AbstractProxy*; src/HttpProxy*; client HttpRequest/HttpResponse graph; tests","Native proxy request and tunnel helpers are removed after libcurl owns proxying.","AbstractProxy*, HttpProxy*, HttpConnection, HttpRequest*, HttpResponse*, HttpDownloadCommand, HttpSkipResponseCommand, and related tests were removed from source and disk. CurlDownloadCommand owns proxy URI, no-proxy, tunnel method, and proxy credential mapping.","RPC server HTTP concepts remain for CM-009."
CM-008.5,verified,Verify auth proxy cookie cleanup,"Focused tests and stale scans","tests; source inventory","Focused behavior tests pass and stale cookie/netrc/proxy source scans match retained ownership.","cmake --build --preset default passed. Focused RequestGroup curl routing tests, FeatureConfigTest, OptionHandlerTest, git diff --check, packaging shell syntax checks, CSV parser checks, source file existence scans, and stale symbol scans passed.","Removed legacy tests covered deleted internals only."
