id,status,area,decision,reference_scope,current_surface,target_or_prune_reason,user_impact,checkpoint
REF0,verified,Reference authority,adapt,"amule-official; emule-official-0.50a; mldonkey-official; wireshark-official; protocol-docs","Historical tracker mentions older deleted references.","Use only the current authoritative local references. Treat the historical ED2K tracker as background, not authority. The RA2 reference map in overview.md records the concrete authoritative entry points.","Future ED2K work stops depending on stale reference assumptions.",RA2
REF1,verified,Architecture ownership,adapt,"aMule/eMule/MLDonkey session and socket ownership","aria2-next RequestGroup, DownloadEngine, Command/EventPoll, Ed2kAttribute, Ed2kCommand, Ed2kKadCommand","Keep aria2-next lifecycle ownership. Current source inventory is mapped in overview.md. Ed2kCommand remains the overloaded TCP owner for server and peer sessions. Ed2kKadCommand remains the single UDP owner for both ED2K server UDP and Kad. Split only when a later checkpoint proves a correctness, capability-truth, or maintainability need.","No sidecar runtime or second event loop is introduced.",RA1
REF2,verified,File and metadata links,adapt,"aMule ED2KLink; eMule ED2KLink; protocol-docs link grammar","ed2k_link.*","Aligned file, server, serverlist, nodeslist, and search link parsing. File links preserve MD4 root hashes, part hashes, AICH roots, inline sources, source hashes, and crypt options. Path separators in file names are normalized before aria2-next output path ownership. File size validation follows the 2^38 byte eMule/aMule limit. Search links are parsed as metadata and not treated as normal downloads.","Users can paste common ED2K links without unsafe filenames or lost metadata.",RA10
REF3,pending,server.met and server state,adapt,"aMule/eMule ServerList and Server; MLDonkey server state; Wireshark tags","ed2k_server.*; Ed2kAttribute serverStates; session hidden state","Align server.met parsing, metadata tags, duplicate merge, malformed input handling, TCP/UDP capability state, retry, and persistence.","Server discovery state survives restart and remains accurate.",RA11
REF4,pending,nodes.dat and Kad state,adapt,"aMule/eMule Kad contacts; MLDonkey nodes.dat; protocol docs","ed2k_kad.*; Ed2kKadState; session hidden Kad state","Align nodes.dat parsing, contact validation, routing snapshot, bootstrap merge, and durable state. Prune obsolete Kad1-only behavior.","Kad bootstrap remains native and restart-safe.",RA11
REF5,pending,Legacy part.met and known databases,replace,"eMule/aMule part.met; known.met; known2.met; clients.met; MLDonkey state","aria2-next control files, session serializer, SharedStore, UploadQueue","Replace legacy databases with aria2-next control/session/shared-store formats. Import legacy formats only if a concrete migration requirement is later approved.","No second ED2K database stack is introduced.",RA11
REF6,pending,Server TCP source discovery,port,"aMule/eMule ServerSocket; MLDonkey server protocol; Wireshark ED2K dissector; protocol docs","Ed2kCommand server path; ed2k_server.*","Align login, IDChange, HighID/LowID, GetSources, GetSources OBFU, FoundSources, FoundSources OBFU, callback, status, messages, server list, search transport, throttling, and persistence.","Server source discovery handles modern and older server formats.",RA20
REF7,pending,Server UDP,adapt,"aMule/eMule ServerUDPSocket; MLDonkey UDP behavior; Wireshark ED2K UDP","Ed2kKadCommand ED2K UDP path; ed2k_server.*; ed2k_peer.*","Align global status, global sources, packed replies, large-file UDP forms, callback fail, retry, and state updates while keeping one UDP command path.","UDP improves discovery without a second subsystem.",RA21
REF8,pending,HighID LowID callback,adapt,"protocol-docs callback; aMule/eMule callback handling; MLDonkey indirect addresses","PeerState, ServerState, Ed2kCommand, Ed2kListenCommand","Align direct HighID paths, server-mediated LowID callback, LowID-to-LowID impossible states, callback fail, timeout, and safe reporting. Prune buddy-only callback unless required by non-pruned transfer paths.","LowID behavior becomes deterministic and honest.",RA21
REF9,pending,Peer hello and eMule info,port,"aMule/eMule ClientTCPSocket and ListenSocket; Wireshark eMule dissector","ed2k_peer.*; Ed2kCommand; Ed2kSharedPeerCommand","Align hello, hello answer, eMule info, misc options, misc options 2, server endpoint fields, and parse tolerance.","Peers see accurate client identity and compatible handshake packets.",RA30
REF10,pending,Capability truth,adapt,"aMule/eMule misc options; MLDonkey defaults; Wireshark tags","EmulePeerInfo; local capability constants","Advertise only capabilities with implemented send, receive, state, error, and fallback paths. Safely parse unsupported remote claims without mirroring them.","Modern peers do not select packet flows aria2-next cannot complete.",RA30
REF11,pending,Crypt and obfuscation,adapt,"aMule/eMule encrypted sockets and obfuscation metadata; Wireshark crypt fields","Source crypt metadata exists; no complete encrypted transport owner is evident","Parse and preserve source/server crypt metadata. Implement encrypted transport only if required and feasible inside existing socket ownership; otherwise keep crypt unadvertised and skip require-crypt sources.","Avoids failed encrypted paths caused by false capability claims.",RA30
REF12,pending,Secure identification,adapt,"eMule secure identification; aMule credits; Wireshark SEC_IDENT/PUBLIC_KEY/SIGNATURE","Upload credit counters exist; secure-ident flow is incomplete","Implement secure-ident only if needed for non-pruned interoperability. Otherwise keep it unadvertised and document credit-security limitations.","Upload credits stay honest without claiming identity verification.",RA30
REF13,pending,Modern peer request flow,port,"aMule/eMule DownloadClient and ClientTCPSocket; protocol docs; Wireshark multipacket","Ed2kCommand peer path; Ed2kSharedResponder; ed2k_peer.*","Align request filename variants, file status, hashset, start upload, queue rank, accept upload, AICH request, source request, failure packets, multipacket, extended multipacket, and file identifiers.","Peer sessions can reach queue or transfer state with modern clients.",RA31
REF14,pending,File identifier model,adapt,"eMule FileIdentifier; aMule KnownFile; protocol docs","Ed2kAttribute hash/size/hashset/AICH metadata","Represent file identity as ED2K root hash, size, optional MD4 hashset, optional AICH root, and compatible comparison rules using aria2-next metadata ownership.","Large-file and AICH-aware peers can validate file identity.",RA31
REF15,pending,Peer transfer control,port,"aMule/eMule transfer states; protocol docs","PeerState; Ed2kPeerTransfer; Ed2kCommand","Align request parts, I64 parts, sending parts, compressed parts, out-of-parts, cancel, no-file, disconnect, duplicate rejection, retry scoring, and backoff.","Failed peers recover cleanly and valid peers can transfer safely.",RA32
REF16,pending,Part transfer and integrity,adapt,"aMule/eMule PartFile/KnownFile/AICH; protocol-docs corruption handling","ed2k_hash.*; ed2k_aich.*; ed2k_compression.*; PieceStorage; DiskAdaptor","Align normal/I64/compressed data, range validation, MD4 part/root/final hashes, AICH root/tree/recovery, corrupt retry, and resume safety through existing disk paths.","Downloaded data is verified and restart-safe.",RA40
REF17,pending,Source policy,adapt,"aMule/eMule source management and DeadSourceList; MLDonkey source handling","ed2k_policy.*; PeerState; scheduler","Align source priority, server/OBFU/inline/resume/SX/Kad sources, callback constraints, queue rank, availability, dead-source backoff, duplicate rejection, and endgame behavior.","Downloads avoid tight loops and unsafe duplicate writes.",RA50
REF18,pending,Source Exchange,port,"aMule/eMule Source Exchange; Wireshark source packets","ed2k_peer.* SourceExchangeEntry and merge policy","Align SX1, SX2, SX2 v4, user hash, server endpoint, crypt options, direct callback metadata where supported, deduplication, loopback/self filtering, and backoff preservation.","Peers can discover extra sources safely.",RA50
REF19,pending,Kad,adapt,"aMule/eMule Kademlia; MLDonkey Kad; protocol docs; Kademlia paper","Ed2kKadCommand; Ed2kKadState; ed2k_kad.*; ed2k_kad_search.*","Align classic Kad nodes.dat, bootstrap, hello, routing, traversal, source search, source publish, keyword search, firewalled checks, refresh, and durable state. Prune obsolete Kad1/UI behavior.","Kad discovery remains native and maintainable.",RA51
REF20,pending,Sharing and known files,adapt,"aMule/eMule SharedFileList/KnownFile; MLDonkey share model","Ed2kSharedStore; Ed2kSharedFile; DownloadResult integration","Align completed-file sharing, imported file hashing, known-file metadata, duplicate handling, file status, hashset, AICH, Source Exchange answer, and part serving.","aria2-next can behave as a cooperative file source where enabled.",RA60
REF21,pending,Upload queue and credits,adapt,"aMule/eMule UploadQueue/UploadClient/ClientCredits; protocol docs","Ed2kUploadQueue; Ed2kSharedResponder; NetStat","Align queue admission, queue rank, slot limits, uploaded/downloaded counters, waiting state, UDP reask rank, and credit behavior. Prune friend slots and UI-only controls.","Peers see valid upload queue behavior without legacy UI policy.",RA60
REF22,pending,Search,adapt,"aMule/eMule SearchList/SearchExpr; MLDonkey search; protocol docs","ed2k_search.*; RPC methods; search RequestGroup","Align server and Kad search, expression terms, typed tags, result merge, source counts, complete source counts, file type, extension, media metadata, source networks, more-results, and generated ED2K links.","Motrix Next can search and start normal ED2K tasks.",RA70
REF23,pending,RPC status and Motrix fields,adapt,"aria2-next RPC patterns; Motrix integration needs; legacy DTOs only as contrast","RpcMethodImpl ED2K status/search fields","Expose stable ED2K task/search/share/upload/Kad/server/peer fields only when they reflect implemented behavior.","Integrators receive accurate status without unsupported claims.",RA70
REF24,verified,GUI application shells,prune,"aMule GUI/web/text client; eMule Windows UI; MLDonkey UI surfaces","aria2-next CLI/RPC","Prune GUI-only, daemon-shell, web UI, telnet UI, remote GUI, chat, preview, collection, captcha, rating, and shared-directory browsing surfaces.","No legacy UI compatibility is promised.",RA2
REF25,verified,NAT helper stacks,replace,"aMule/eMule UPnP/NAT helpers; MLDonkey port helpers","aria2-next listen-port options and existing networking","Replace legacy UPnP/NAT-PMP/router-test stacks with explicit aria2-next listen-port configuration unless a native owner is later approved.","No extra NAT dependency is introduced.",RA2
